{
  "source": "ground_truth",
  "page_no": 1,
  "month_written": "Sep 2026",
  "page_no_written": "1",
  "table_top": 0.146,
  "table_bottom": 0.945,
  "blank_row_slots": 2,
  "rows": [
    {
      "row_index": 1,
      "cells": {
        "date": {
          "value": "01/09",
          "status": "CLEAR",
          "struck": null,
          "candidates": [],
          "note": null
        },
        "grn_no": {
          "value": "4401",
          "status": "CLEAR",
          "struck": null,
          "candidates": [],
          "note": null
        },
        "supplier": {
          "value": "Qasr Pkg",
          "status": "CLEAR",
          "struck": null,
          "candidates": [],
          "note": null
        },
        "item": {
          "value": "Cartons 5-ply",
          "status": "CLEAR",
          "struck": null,
          "candidates": [],
          "note": null
        },
        "lot_no": {
          "value": "L2609-001",
          "status": "CLEAR",
          "struck": null,
          "candidates": [],
          "note": null
        },
        "qty": {
          "value": "2000",
          "status": "CLEAR",
          "struck": null,
          "candidates": [],
          "note": null
        },
        "unit": {
          "value": "pcs",
          "status": "CLEAR",
          "struck": null,
          "candidates": [],
          "note": null
        },
        "recd_by": {
          "value": "B.H.",
          "status": "CLEAR",
          "struck": null,
          "candidates": [],
          "note": null
        }
      }
    },
    {
      "row_index": 2,
      "cells": {
        "date": {
          "value": "01/09",
          "status": "CLEAR",
          "struck": null,
          "candidates": [],
          "note": null
        },
        "grn_no": {
          "value": "4402",
          "status": "CLEAR",
          "struck": null,
          "candidates": [],
          "note": null
        },
        "supplier": {
          "value": "Taraz Poly",
          "status": "CLEAR",
          "struck": null,
          "candidates": [],
          "note": null
        },
        "item": {
          "value": "Polybags 12x16",
          "status": "CLEAR",
          "struck": null,
          "candidates": [],
          "note": null
        },
        "lot_no": {
          "value": "L2609-002",
          "status": "CLEAR",
          "struck": null,
          "candidates": [],
          "note": null
        },
        "qty": {
          "value": "25000",
          "status": "CLEAR",
          "struck": null,
          "candidates": [],
          "note": null
        },
        "unit": {
          "value": "pcs",
          "status": "CLEAR",
          "struck": null,
          "candidates": [],
          "note": null
        },
        "recd_by": {
          "value": "B.H.",
          "status": "CLEAR",
          "struck": null,
          "candidates": [],
          "note": null
        }
      }
    },
    {
      "row_index": 3,
      "cells": {
        "date": {
          "value": "02/09",
          "status": "CLEAR",
          "struck": null,
          "candidates": [],
          "note": null
        },
        "grn_no": {
          "value": "4403",
          "status": "CLEAR",
          "struck": null,
          "candidates": [],
          "note": null
        },
        "supplier": {
          "value": "Zarnab Chem",
          "status": "CLEAR",
          "struck": null,
          "candidates": [],
          "note": null
        },
        "item": {
          "value": "Caustic soda flakes",
          "status": "CLEAR",
          "struck": null,
          "candidates": [],
          "note": null
        },
        "lot_no": {
          "value": "L2609-003",
          "status": "CLEAR",
          "struck": null,
          "candidates": [],
          "note": null
        },
        "qty": {
          "value": "50",
          "status": "CLEAR",
          "struck": null,
          "candidates": [],
          "note": null
        },
        "unit": {
          "value": "bags",
          "status": "CLEAR",
          "struck": null,
          "candidates": [],
          "note": null
        },
        "recd_by": {
          "value": "B.H.",
          "status": "CLEAR",
          "struck": null,
          "candidates": [],
          "note": null
        }
      }
    },
    {
      "row_index": 4,
      "cells": {
        "date": {
          "value": "03/09",
          "status": "CLEAR",
          "struck": null,
          "candidates": [],
          "note": null
        },
        "grn_no": {
          "value": "4404",
          "status": "CLEAR",
          "struck": null,
          "candidates": [],
          "note": null
        },
        "supplier": {
          "value": "Rehbar Threads",
          "status": "CLEAR",
          "struck": null,
          "candidates": [],
          "note": null
        },
        "item": {
          "value": "Thread cones 40/2",
          "status": "CLEAR",
          "struck": null,
          "candidates": [],
          "note": null
        },
        "lot_no": {
          "value": "L2609-004",
          "status": "CLEAR",
          "struck": null,
          "candidates": [],
          "note": null
        },
        "qty": {
          "value": "600",
          "status": "CLEAR",
          "struck": null,
          "candidates": [],
          "note": null
        },
        "unit": {
          "value": "cones",
          "status": "CLEAR",
          "struck": null,
          "candidates": [],
          "note": null
        },
        "recd_by": {
          "value": "S.A.",
          "status": "CLEAR",
          "struck": null,
          "candidates": [],
          "note": null
        }
      }
    },
    {
      "row_index": 5,
      "cells": {
        "date": {
          "value": "04/09",
          "status": "CLEAR",
          "struck": null,
          "candidates": [],
          "note": null
        },
        "grn_no": {
          "value": "4405",
          "status": "CLEAR",
          "struck": null,
          "candidates": [],
          "note": null
        },
        "supplier": {
          "value": "Saahil Pallets",
          "status": "CLEAR",
          "struck": null,
          "candidates": [],
          "note": null
        },
        "item": {
          "value": "Wooden pallets",
          "status": "CLEAR",
          "struck": null,
          "candidates": [],
          "note": null
        },
        "lot_no": {
          "value": "L2609-005",
          "status": "CLEAR",
          "struck": null,
          "candidates": [],
          "note": null
        },
        "qty": {
          "value": "120",
          "status": "CLEAR",
          "struck": null,
          "candidates": [],
          "note": null
        },
        "unit": {
          "value": "pcs",
          "status": "CLEAR",
          "struck": null,
          "candidates": [],
          "note": null
        },
        "recd_by": {
          "value": "S.A.",
          "status": "CLEAR",
          "struck": null,
          "candidates": [],
          "note": null
        }
      }
    },
    {
      "row_index": 6,
      "cells": {
        "date": {
          "value": "05/09",
          "status": "CLEAR",
          "struck": null,
          "candidates": [],
          "note": null
        },
        "grn_no": {
          "value": "4406",
          "status": "CLEAR",
          "struck": null,
          "candidates": [],
          "note": null
        },
        "supplier": {
          "value": "Nayab Labels",
          "status": "CLEAR",
          "struck": null,
          "candidates": [],
          "note": null
        },
        "item": {
          "value": "Woven labels",
          "status": "CLEAR",
          "struck": null,
          "candidates": [],
          "note": null
        },
        "lot_no": {
          "value": "L2609-006",
          "status": "CLEAR",
          "struck": null,
          "candidates": [],
          "note": null
        },
        "qty": {
          "value": "10000",
          "status": "CLEAR",
          "struck": null,
          "candidates": [],
          "note": null
        },
        "unit": {
          "value": "pcs",
          "status": "CLEAR",
          "struck": null,
          "candidates": [],
          "note": null
        },
        "recd_by": {
          "value": "B.H.",
          "status": "CLEAR",
          "struck": null,
          "candidates": [],
          "note": null
        }
      }
    },
    {
      "row_index": 7,
      "cells": {
        "date": {
          "value": "07/09",
          "status": "CLEAR",
          "struck": null,
          "candidates": [],
          "note": null
        },
        "grn_no": {
          "value": "4407",
          "status": "CLEAR",
          "struck": null,
          "candidates": [],
          "note": null
        },
        "supplier": {
          "value": "Qasr Pkg",
          "status": "CLEAR",
          "struck": null,
          "candidates": [],
          "note": null
        },
        "item": {
          "value": "Cartons 3-ply",
          "status": "CLEAR",
          "struck": null,
          "candidates": [],
          "note": null
        },
        "lot_no": {
          "value": "L2609-007",
          "status": "CLEAR",
          "struck": null,
          "candidates": [],
          "note": null
        },
        "qty": {
          "value": "1500",
          "status": "CLEAR",
          "struck": null,
          "candidates": [],
          "note": null
        },
        "unit": {
          "value": "pcs",
          "status": "CLEAR",
          "struck": null,
          "candidates": [],
          "note": null
        },
        "recd_by": {
          "value": "B.H.",
          "status": "CLEAR",
          "struck": null,
          "candidates": [],
          "note": null
        }
      }
    },
    {
      "row_index": 8,
      "cells": {
        "date": {
          "value": "07/09",